1 miles,"$8,129 ",GSX-S750,New 2022 Suzuki Sportbike,"The GSX-S750 blends GSX-R750-derived engine performance with an ergonomically sound chassis to fashion a naked sportbike that gathers attention everywhere you ride it, thanks to its aggressive appearance. The 2022 GSX-S750’s Metallic Matte Black bodywork is complemented by a blacked-out engine, wheels, and select chassis components. Aggressive styling, strong performance, and comfortable riding posture set the GSX-S750 apart from other middleweight sportbikes, and many of those competitors cost considerably more to purchase and own."
1 miles,"$8,129 ",GSX-S750,New 2022 Suzuki Sportbike,"The GSX-S750 blends GSX-R750-derived engine performance with an ergonomically sound chassis to fashion a naked sportbike that gathers attention everywhere you ride it, thanks to its aggressive appearance. The 2022 GSX-S750’s Metallic Matte Black bodywork is complemented by a blacked-out engine, wheels, and select chassis components. Aggressive styling, strong performance, and comfortable riding posture set the GSX-S750 apart from other middleweight sportbikes, and many of those competitors cost considerably more to purchase and own."
,"$11,299 ",GSX-S1000,New 2022 Suzuki Sportbike,"The GSX-S1000 launched in 2015 as a new model developed to bring the fun of sport riding to riders on the street. At its heart was a street-tuned version of the powerful long-stroke engine that carried the GSX-R1000 to countless superbike and endurance race victories. This engine was skillfully paired with a compact and lightweight chassis, state-of-the-art running gear and a comfortable upright riding position. Just as the GSX-R1000 was built to “own the racetrack”, the GSX-S1000 was created to “own the street”."
420 miles,"$13,995 ",Boulevard M109R B.O.S.S.,  2022 Suzuki Cruiser,"This   2022 Suzuki Boulevard M109R B.O.S.S. Motorcycle is for sale at RedLine Powersports Commonwealth located in Prince George, Virginia. Reach out to RedLine Powersports today, CONTACT US. If this isn't the exact powersports vehicle you're looking for don't hesitate to go back and REVISE YOUR SEARCH. We're sure to have the perfect choice for you in our showroom in Virginia. Visit RedLine Powersports Commonwealth, Virginia’s premier Powersports dealership."
,"$8,949 ",GSX-S750Z ABS,New 2022 Suzuki Sportbike,"The GSX-S750Z ABS blends GSX-R750-derived engine performance with an ergonomically sound chassis to fashion a naked sportbike that gathers attention everywhere you ride it, thanks to its aggressive appearance. The 2022 GSX-S750Z ABS’s striking Metallic Triton Blue and Glass Sparkle Black bodywork is complemented by a blacked-out engine and select chassis components. Fluorescent yellow logos and graphics on the bodywork and wheels accent the GSX-S750Z ABS’s aggressive styling. Strong performance, and comfortable riding posture set the GSX-S750Z ABS apart from other middleweight..."
,"$9,095 ",Boulevard C50T C50 T,New 2022 Suzuki Cruiser,"Ready for a highway run? With the Suzuki 2022 Boulevard C50T, you’ll find yourself equally at home on city streets or out on the interstate. Its fuel-injected, 50 cubic inch, V-twin engine delivers abundant torque and is engineered for comfort. Its bold styling stands out in a crowd, while a long list of features make it ideal for comfortable long-distance cruising. Tour-ready features include a spacious riding position, aerodynamic windshield, custom-made leather-look saddlebags with studs that match the studded dual seats that deliver all-day rider and passenger comfort."
,"$8,999 ",RM-Z450,New 2022 Suzuki Dirt Bike,"2022 Suzuki RM-Z450, 2022 Suzuki RM-Z450"
,"$7,599 ",RM-Z250,  2022 Suzuki Dirt Bike,"The choice of wise professionals and privateers everywhere, the 2022 RM-Z250 is ready for battle. The agile RM-Z250 combines the sleek, race-ready appearance of the RM-Z450 with a versatile engine and responsive chassis to deliver superior performance. Using Suzuki’s “RUN, TURN, and STOP” philosophy, factory engineers have made the RM-Z250 a formidable competitor."
1 miles,"$8,129 ",GSX-S750,New 2022 Suzuki Sportbike,"The GSX-S750 blends GSX-R750-derived engine performance with an ergonomically sound chassis to fashion a naked sportbike that gathers attention everywhere you ride it, thanks to its aggressive appearance. The 2022 GSX-S750’s Metallic Matte Black bodywork is complemented by a blacked-out engine, wheels, and select chassis components. Aggressive styling, strong performance, and comfortable riding posture set the GSX-S750 apart from other middleweight sportbikes, and many of those competitors cost considerably more to purchase and own."
"3,009 miles","$16,591 ",Hayabusa,  2022 Suzuki Sportbike,"Hayabusa… Famed for its abundant power, agility and majestic presence. Legendary for establishing new levels of ultimate sport performance, and for retaining the number one position for the past two decades in the class it created. The 2022 Hayabusa delivers an even smoother ride and nimbler handling via reimagined electronic systems that optimize performance making it more controllable, predictable, and reliable."
1 miles,"$2,848 ",DR-Z125LM2,  2022 Suzuki Mx,"Here comes the 2022 DR-Z125L to make sure young and smaller stature riders can tackle the dirt. Larger 19-inch front and 16-inch rear tires, as well as a front disc brake, deliver big bike performance to a size-appropriate motorcycle. Here’s the perfect platform to build essential riding skills upon, as the DR-Z125L has a true manual clutch and a five-speed transmission so riders can develop these skills as they advance within the sport of motorcycling. Styled to mirror Suzuki’s Championship-winning RM-Z and RMX models, this DR-Z arrives with a race-oriented look, while the sharp handling and strong low-end and mid-range power provide the get-up-and-go that defines off-road bikes. The bike’s race ready looks prove you can’t judge a book by its cover, because the DR-Z125L is an unassuming, easy to ride package packed with loads of fun."
,"$6,495 ",RM-Z250,  2021 Suzuki Sportbike,"2021 Suzuki RM-Z250,"
,"$2,995 ",DR-Z125L,New 2021 Suzuki Dirt Bike,"Here comes the DR-Z125L to make sure young and smaller stature riders can tackle the dirt. Larger 19-inch front and 16-inch rear tires, as well as a front disc brake, deliver big bike performance to a size-appropriate motorcycle. Styled to mirror Suzuki’s Championship-winning RM-Z and RMX models, this DR-Z arrives with a race-oriented look, while the sharp handling and strong low-end and mid-range power provide the get-up-and-go that defines off-road bikes. The bike's ready looks prove that you can’t judge a book by its cover, because the DR-Z125L is an unassuming, easy to ride package packed with loads of fun."
,"$3,295 ",RM85 2-Stroke 250,  2021 Suzuki Dirt Bike,"2021 Suzuki RM85 2-Stroke , We have a 2021 Suzuki RM 85! Bike starts first kick and runs great! Perfect starter bike! Great for track or trail riding! All stock and ready to go. Easy to maintain and reliable! $3295 or trade! Financing available and we accept credit cards! Call or text 208-716-3244 for more details or come down to Harper Motorsports and check it out! WE SHIP TOYS NATIONWIDE! ANY ACCESSORIES CAN BE ADDED TO OUR TOYS AND WE OFFER WARRANTIES! 7168 N Government Way Dalton Gardens ID 83815 Harper-Motorsports.com We are open Monday-Tuesday by APPOINTMENT ONLY Open Wednesday - Saturday 10:00am-5:00pm Closed Sunday If you would like to make an appt to see one of our toys please call to set it up. We are very flexible and happy to meet any day!"
,"$6,999 ",RM-Z250,  2021 Suzuki Dirt Bike,"The choice of wise professionals and privateers everywhere, the 2021 RM-Z250 is ready for battle. The agile RM-Z250 combines the sleek, race-ready appearance of the RM-Z450 with a versatile engine and responsive chassis to deliver superior performance. Using Suzuki’s “RUN, TURN and STOP” philosophy, factory engineers have made the RM-Z250 a formidable competitor."
821 miles,"$7,697 ",DR-Z400SM,  2021 Suzuki Dual Sport,"Suzuki's SuperMoto DR-Z400SM is based on the proven DR-Z400S. So it combines Supermotard style and features in a narrow, lightweight, street-legal package. This bike brings off-road soul and fun to paved roads. It’s not uncommon to take the SuperMoto down a twisty forest road, around tight canyon corners, or through commuter traffic."
"11,170 miles","$12,790 ",GSX-R 750 100TH ANNIVERSARY EDITION,  2021 Suzuki Sportbike,2021 Suzuki GSX-R750 100th Anniversary
"2,555 miles","$6,995 ",SV650,  2020 Suzuki Sportbike,"2020 Suzuki SV650, ***Just In!*** This super clean 2020 Suzuki SV650 will not disappoint! Only 2K Miles! One Owner! Must See! We can get you on this bike regardless of most credit situations! We have special lease financing options that will allow you to take this bike home today!* Been denied? Give us a call! Clean VinSmart Report Never Down! 645CC Engine 6 Speed Transmission All Keys Owner's Manual And Much More! Looks Great! Runs Great! Rides Great! NO STORIES! Come visit our all indoor showroom and visit with our friendly veteran owned and operated staff! Trade Ins Welcome! Call for More Info! 480-877-7010 OR IF YOU PREFER, TEXT Bud @ 503-867-1477 for more info! Or Please feel free to email us! Moto A2Z 8743 E Pecos RD #126 Mesa, AZ 85212 Disclaimer: Advertised pricing excludes applicable taxes title and licensing, dealer set up, destination, reconditioning and are subject to change without notice. Pricing may exclude any added parts, accessories or installation unless otherwise noted. Contact dealer for details *O.A.C. Financing subject to credit approval. Not all applicants will qualify. - Tachometer, Fuel Injected, Disc Brakes - Contact David Bossert at 480-877-7010 or david@motoa2z.com for more information. -"
"1,120 miles","$11,199 ",GSX-R750,  2020 Suzuki Sportbike,"Over three decades ago, Suzuki revolutionized sportbikes with the introduction of the GSX-R750. Ever since then, the GSX-R750 has remained true to its original concept and championship-winning heritage. On the road or on the track, the GSX-R750 delivers a breathtaking combination of outstanding engine performance, crisp handling, compact size, and light weight. Its secret is an unequaled pairing of 750cc performance with the lightweight, compact chassis of a 600cc Supersport, complemented by technologically advanced suspension front and rear. Try a GSX-R750 and you’ll quickly realize this motorcycle defines performance riding from the center of the sportbike class."
"1,320 miles","$13,490 ",V-STROM 1050,  2020 Suzuki Dual Sport,Introducing the new generation 2020 V-STROM 1050XT. The latest entry into the V-STROM legend is here to help you escape into the wilderness and explore to your heart's content. A sleek look with the latest features allows for a smooth and comfortable ride. Limitless potential is engineered in so you can continue your adventure without pause.;;Distinctive styling incorporates elements of both Suzuki's legendary DR-Z Dakar racer and the large DualSport DR-Big. The characteristic beak design first adopted by Suzuki stays true to its heritage while being more aggressive and bolder for the new generation V-STROM.;;The V-S
"12,578 miles","$14,799 ",V-Strom 1050,  2020 Suzuki Dual Sport,"2020 Suzuki V-Strom 1050, 2020 Suzuki V-Strom 1050"
"2,823 miles","$8,595 ",GSX-S750Z ABS,  2020 Suzuki Standard,"The GSX-S750Z ABS blends GSX-R750-derived engine performance with an ergonomically sound chassis to fashion a naked sportbike that gathers attention everywhere you ride it, thanks to its unique appearance. The GSX-S750Z ABS’s stunning red and white bodywork is complemented by a blacked-out engine and chassis components that set it apart from other middleweight sportbikes."
"2,158 miles","$11,291 ",Katana,  2020 Suzuki Standard,"Through its products, Suzuki has embraced Japanese culture and has found opportunities to celebrate beautiful, unique portions of its society and nature. The new KATANA faithfully honors that commitment while finding a bold new expression for Suzuki technology and styling. This new motorcycle was inspired by the original 1982 Suzuki Katana that created a sensation with the motorcycling world when it debuted. Both motorcycles blend a powerful Suzuki engine with radical styling and spirit of the traditional Japanese sword of the samurai."
"2,926 miles","$5,794 ",DR-Z400S,  2020 Suzuki Dual Sport,"The 2020 DR-Z400S is the latest version of the motorcycle that’s the foundation of the modern DualSport movement. Starting with the DR350S and then again with the DR-Z400S, Suzuki made fun, reliable, and capable motorcycles available to anyone who’s ready to take a ride down their favorite off-road trail or ribbon of asphalt."
"5,570 miles","$7,988 ",V-Strom 650,  2020 Suzuki Dual Sport,"2020 Suzuki V-Strom 650, 2020 Suzuki V-Strom 650"
"7,072 miles","$11,970 ",GSX-R600,  2020 Suzuki Sportbike,2020 Suzuki GSX-R600
"4,707 miles","$12,995 ",Boulevard M109R B.O.S.S.,  2020 Suzuki Cruiser,
"4,051 miles","$14,000 ",V-Strom 1000XT Adventure,  2019 Suzuki Dual Sport,"2019 Suzuki V-Strom 1000XT Adventure, ** SPRING SEASON IS FINALLY HERE ** CALL US NOW at 801.562.0100 | Your one-stop-shop for MOTORCYCLES ** MUST SEE IN PERSON ** (stock# P600B) (4,051 miles) Harrison Eurosports (DLR# 7866) ** DLR MUST ARRANGE FINANCING ** SEE DEALER FOR DETAILS  2019 Suzuki V-Strom 1000XT Adventure"
"1,639 miles","$12,991 ",Boulevard M109R B.O.S.S.,  2019 Suzuki Cruiser,"This is the performance cruiser other bikes wish they were. The dark and muscular M109R B.O.S.S. has a powerful V-twin engine using some of the largest pistons in the industry a bike that will get your adrenaline flowing whenever you ride. This 109 cubic inch engine is wrapped with aggressive blacked out styling that includes slash-cut mufflers, drag-style bars, a supplied solo seat cowl, and a distinctively shaped headlight nacelle that’s uniquely Suzuki. This bike is not just about looks, as stout inverted forks, a hidden single-shock rear suspension, and an ideally designed saddle deliver responsive handling and an exceptionally comfortable ride. Performance never looked so good, or so dark."
"21,724 miles","$6,599 ",V-Strom 650,  2019 Suzuki Dual Sport,"2019 Suzuki V-Strom 650, 2019 Suzuki V-Strom 650"
931 miles,"$7,995 ",BOULEVARD M50,  2019 Suzuki Cruiser,2019 Suzuki Boulevard M50
3 miles,"$5,995 ",RM-Z450,  2018 Suzuki Dirt Bike,"Completely redesigned for 2018, the RM-Z450 wraps a sleek, race-ready appearance around a stronger engine and a nimble chassis that continues the Suzuki tradition of extraordinarily precise handling. Developed using Suzuki’s RUN, TURN and STOP philosophy that creates a Winning Balance, the 2018 RM-Z450 has stronger brakes for better stopping power, a wider spread of engine muscle with higher peak power, and a chassis that is stronger, lighter and more nimble to raise the standard for cornering performance."
"5,423 miles","$10,891 ",GSX-R600,  2018 Suzuki Sportbike,"The Suzuki GSX-R600 is a class-leading sport bike worthy of its race-winning GSX-R heritage. Whether you’re carving through your favorite canyon or dominating the racetrack, it offers unparalleled performance. A compact, powerful 4-cylinder engine demonstrates the advanced race-proven technology of the GSX-R line when you hit the throttle and push it to redline, while supremely refined suspension systems front and rear help provide precise, responsive handling. Wrapped in aerodynamic and lightweight bodywork that’s lifted from the race track, the GSX-R600 can not only win races, it can win envy."
"4,389 miles","$5,633 ",Burgman 400 ABS,  2018 Suzuki Scooter,"2018 Suzuki Burgman 400 ABS, Click ""More"" for additional info. ***Broward Motorsports of Palm Beach*** ***2300 Okeechobee Blvd. West Palm Beach, Florida 33409*** ***561-296-9696 call or text now*** ***We are conveniently located in West Palm Beach, Florida, just minutes from I-95 and the Florida Turnpike.*** ***Our management team has over 100+ years of POWERSPORTS experience.*** ***Amazing OEM Certified Technicians readily available.*** ***Finance approvals for 90%+ of applicants. Apply now!*** ***We have a massive facility showcasing 500+ units in stock at all times.*** ***Typically stocking 50+ pre-loved vehicles, inspected and certified to ride.*** ***We are open 6 days per week, Monday-Saturday 9:00 AM - 7:00 PM, to serve you.*** ***Tri-county deliveries are available 6 days per week.*** ***Wide range of electric vehicles available for all types of terrain.*** ***We offer fun for all age groups, from 6-120, we have a toy for you!! ***We offer GPS tracking devices that allow you to see where your favorite toy is at all times.*** ***DISCOUNTED CASH PRICING!!!***   ***Broward Motorsports of Palm Beach***  ***2300 Okeechobee Blvd. West Palm Beach, Florida 33409***  ***561-296-9696 call or text now***  ***We are conveniently located in West Palm Beach, Florida, just minutes from I-95 and the Florida Turnpike.***  ***Our management team has over 100+ years of POWERSPORTS experience.***  ***Amazing OEM Certified Technicians readily available.***  ***Finance approvals for 90%+ of applicants. Apply now!***  ***We have a massive facility showcasing 500+ units in stock at all times.***  ***Typically stocking 50+ pre-loved vehicles, inspected and certified to ride.***  ***We are open 6 days per week, Monday-Saturday 9:00 AM - 7:00 PM, to serve you.***  ***Tri-county deliveries are available 6 days per week.***  ***Wide range of electric vehicles available for all types of terrain.***  ***We offer fun for all age groups, from 6-120, we have a toy for you!!  ***We offer GPS tracking devices that allow you to see where your favorite toy is at all times.***  ***DISCOUNTED CASH PRICING!!!*** 2018 Suzuki Burgman 400 ABS"
"6,843 miles","$11,495 ",DL1000 V-Strom XT,  2018 Suzuki Dual Sport,
"6,082 miles","$7,999 ",Boulevard M90,  2018 Suzuki Cruiser,"The Suzuki Boulevard M90 is a muscle cruiser with sleek, yet powerful styling that includes slash-cut mufflers, a hard-tail look, and drag-style bars. The distinctively shaped headlight nacelle presents a look that’s uniquely Suzuki. Wherever you ride, the M90 offers responsive handling and an exceptionally comfortable ride, thanks to its inverted forks, smooth, single-shock rear suspension and ideally designed saddle. Its 90-cubic-inch V-twin engine with Suzuki fuel injection punches out tremendous torque and exhilarating acceleration from idle to redline."
"15,585 miles","$13,995 ",GSX-R 1300 HAYABUSA BASE,  2018 Suzuki Sportbike,2018 Suzuki GSX-1300R Hayabusa
"12,189 miles","$7,799 ",V-Strom 650,  2017 Suzuki Dual Sport,"2017 Suzuki V-Strom 650, 2017 Suzuki V-Strom 650 with 12189 miles and comes with matching hard bags and top case and crash bars. Renowned for its versatility, reliability and value, the V-Strom 650 has attracted many riders who use it for touring, commuting, or a fun ride when the spirit moves them. It is a touchstone motorcycle balanced with a natural riding position, comfortable seat and a flexible engine character that produces stress-free riding during brief daily use or a high-mile adventure.  2017 Suzuki V-Strom 650"
"1,160 miles","$14,499 ",Hayabusa,  2017 Suzuki Sportbike,
"3,642 miles","$13,995 ",HAYABUSA,  2017 Suzuki Sportbike,2017 Suzuki Hayabusa
"12,658 miles","$5,999 ",Boulevard C50T C50 T,  2016 Suzuki Touring,2016 - Suzuki Motor of America Inc. - Boulevard C50T - Stock #100451
"8,674 miles","$4,495 ",M50 Boulevard,  2014 Suzuki Cruiser,"2014 Suzuki M50 Boulevard , We have a 2014 Suzuki Boulevard M50! This bike runs and drives perfect with no issues! Only 8674 miles ! Great cruiser , very smooth and easy to ride ! Don t miss out on this one! $4495 or trade! Financing available and we accept credit cards! Call or text 208-716-3244 for more details or come down to Harper Motorsports and check it out! WE SHIP TOYS NATIONWIDE! ANY ACCESSORIES CAN BE ADDED TO OUR TOYS! 7168 N Government Way Dalton Gardens ID 83815 Harper-Motorsports.com We are open Monday-Tuesday by APPOINTMENT ONLY Open Wednesday - Saturday 10:00am-5:00pm Closed Sunday If you would like to make an appt to see one of our toys please call to set it up. We are very flexible and happy to meet any day!"
"14,889 miles","$9,995 ",GSX-R600,  2012 Suzuki Sportbike,"2012 Suzuki GSX-R600, ***Just In!*** This super clean 2012 Suzuki GSX-R 600 will not disappoint! Only 14K Miles! Must See! We can get you on this bike regardless of most credit situations! We have special lease financing options that will allow you to take this bike home today!* Been denied? Give us a call! Clean VinSmart Report Never Down! 600CC Engine 6 Speed Manual Transmission Moto GP Style 1 Up 5 Down Shifting Brembo Brakes M4 Exhaust Tail Tidy Kit Frame Sliders CRG Levers Domino Grips Passenger Seat & Pegs Blacked Out Windshield Tank Protector And Much More! Looks Great! Runs Great! Rides Great! NO STORIES! Come visit our all indoor showroom and visit with our friendly veteran owned and operated staff! Trade Ins Welcome! Call for More Info! 480-877-7010 OR IF YOU PREFER, TEXT Bud @ 503-867-1477 for more info! Or Please feel free to email us! Moto A2Z 8743 E Pecos RD #126 Mesa, AZ 85212 Disclaimer: Advertised pricing excludes applicable taxes title and licensing, dealer set up, destination, reconditioning and are subject to change without notice. Pricing may exclude any added parts, accessories or installation unless otherwise noted. Contact dealer for details *O.A.C. Financing subject to credit approval. Not all applicants will qualify. - Tachometer, Fuel Injected, Disc Brakes, Custom Exhaust, Windshield, Custom Grips - Contact David Bossert at 480-877-7010 or david@motoa2z.com for more information. -"
"23,354 miles","$11,990 ",GSX R1000,  2011 Suzuki Sportbike,"2011 Suzuki GSX R1000, BLACK!! EXCELLENT SHAPE, HARD TO FIND! HURRY IN! @INTEGRITY CYCLES!!  The GSX-R1000 is a motorcycle that has been fine-tuned and developed on racetracks and on asphalt around the world. It’s a machine that resolutely defines dominance, having won an incredible seven straight AMA Superbike Championships in a row."
"13,686 miles","$7,399 ",BOULEVARD,  2011 Suzuki Cruiser,"2011 SUZUKI BOULEVARD,"
"18,618 miles","$10,500 ",GSX1300R HAYABUSA,  2008 Suzuki Standard,"2008 SUZUKI GSX1300R HAYABUSA, Flip My Cycle is a motorcycle dealership located in Fayetteville, NC. Flip My Cycle has over 180+ motorcycles for sale to choose from. We are veteran owned and operated and will help you buy, sell, trade or consign your motorcycle 365 days a year. Our inventory is always changing so check out our website to see what is currently in stock here. https://www.flipmycycle.com/ We can get you approved even with bad credit and good credit at rates as low as 4%. With over 90% of our customers getting approved to ride, they leave the same day. Check out our current inventory that we can ship nationwide at https://www.flipmycycle.com/ FIREBLADE,S100RR,GSX-R1,ZX10R,YZF-R1,RSV4,H2, 1198,MV-F4,SPEED TRIPLE,H2R,PALINGALE V4R, STREET FIGHTER V2,XSR900,F41000AGO,998,RC51,RSV100R,BIMOTA DB7, MV Agusta F3 800 Suzuki GSX-R750 MV Agusta Brutale 800RR"
"7,965 miles","$8,950 ",Boulevard C109R C109RTK8,  2008 Suzuki Cruiser,"2008 Suzuki Boulevard C109R , DEALER NOTES:Being offered for sale is a very rare and very tastefully modified 2008 Suzuki C109RT with only 8000 miles.NUMBER OF PREVIOUS OWNERS:CURRENT MILEAGE:(May very slightly due to us test riding the bikes, generally less than 200 miles)TITLE STATUS:Clean (No Brands, No liens, Actual Mileage)ORIGINAL OWNERSHIP ITEMS INCLUDED:UPGRAGES:Freedom Full ExhaustMini Bullet SIgnalsRECENT SERVICES:Engine Oil and filter (Just performed here at our dealership at time of trade in)COSMETIC IMPERFECTIONS:NONE - FLAWLESS!!!MECHANICAL IMPERFECTIONS:NONE - FLAWLESS!!!PRE-OWNED CERTIFICATION LEVEL:GOLD LEVEL CERTIFIED!WARRANTY TYPE:30 Day / 1000 mile FULL wheel to wheel no hassle warrantyPLEASE FEEL FREE TO CONTACT US FOR A COPY OF OUR INDUSTRY LEADING PRE-OWNED VEHICLE QUALITY ASSURANCE INSPECTION CHECKLIST THAT WAS COMPLETED FOR THIS BIKE! Visit Black Market Bikez LLC. online at blackmarketbikez.com to see more pictures of this vehicle or call us at 717-515-0064 today to schedule your test drive."
