,"$6,699 ",DR-Z400SM,New 2023 Suzuki Competition,"Suzuki's 2023 SuperMoto DR-Z400SM is based on the proven DR-Z400S. So it combines Supermotard style and features in a narrow, lightweight, street-legal package. This bike brings off-road soul and fun to paved roads. It’s not uncommon to take the SuperMoto down a twisty forest road, around tight canyon corners, or through commuter traffic."
,"$7,799 ",DR-Z400SM,New 2023 Suzuki Competition,
2 miles,"$12,849 ",GSX-R750,New 2023 Suzuki Sportbike,
,"$7,799 ",DR-Z400SM,New 2023 Suzuki Competition,
,"$18,199 ",GSX-R1000R,New 2023 Suzuki Sportbike,
2 miles,"$3,499 ",DR-Z125L,New 2023 Suzuki Dirt Bike,
1 miles,"$18,199 ",GSX-R1000R,New 2023 Suzuki Sportbike,
1 miles,"$7,399 ",DR650SEM2,New 2022 Suzuki Dual Sport,"2022 SUZUKI DR650SEM2,    Key Features  Engine Features"
,"$3,399 ",DR-Z125L,New 2022 Suzuki Dirt Bike,"Here comes the 2022 DR-Z125L to make sure young and smaller stature riders can tackle the dirt. Larger 19-inch front and 16-inch rear tires, as well as a front disc brake, deliver big bike performance to a size-appropriate motorcycle. Here's the perfect platform to build essential riding skills upon, as the DR-Z125L has a true manual clutch and a five-speed transmission so riders can develop these skills as they advance within the sport of motorcycling. Styled to mirror Suzuki's Championship-winning RM-Z and RMX models, this DR-Z arrives with a race-oriented look, while the sharp handling and strong low-end and mid-range power provide the get-up-and-go that defines off-road bikes. The bike's race ready looks prove you can't judge a book by its cover, because the DR-Z125L is an unassuming, easy to ride package packed with loads of fun."
,"$6,499 ",RM-Z 250,New 2022 Suzuki Competition,"The choice of wise professionals and privateers everywhere, the 2022 RM-Z250 is ready for battle. The agile RM-Z250 combines the sleek, race-ready appearance of the RM-Z450 with a versatile engine and responsive chassis to deliver superior performance. Using Suzuki's “RUN, TURN, and STOP philosophy, factory engineers have made the RM-Z250 a formidable competitor.;;The RM-Z250 has always set the standard as the best handling 250 on the track. Fed by a dual injector EFI system, a center-port cylinder head and an AMA-compliant exhaust, the RM-Z250's engine delivers strong, usable power through the entire rev-range.;;The twin-spar aluminum frame and hydro-formed swingarm carry a KYB-supplied suspension that includes a coil spring fork and a shock with four-way damping force adjustment. Strong brakes and ergonomically shaped bodywork help keep the rider in control as the RM-Z250 carves up the racetrack.;;Tuning the fuel injection and ignition for maximum performance is easy thanks to Suzuki's smartphone-based MX-Tuner and proven fuel-coupler system. Suzuki's Winning Balance is on display with the 2022 RM-Z250 as it maintains its own high standard for cornering performance.;;Competition motorcycles like the RM-Z250 can only be ridden on non-public land in California per California Air Resource Board (CARB) regulations."
1 miles,"$4,999 ",GSX250R ABS,New 2022 Suzuki Sportbike,"2022 Suzuki GSX250R ABS,  4-stroke, SOHC, parallel-twin  248cc  2.10 in. x 2.17 in. (53.5 mm x 55.2 mm)  Liquid  11.5:1  Fuel injection with SDTV  Electronic ignition (transistorized)  6-speed constant mesh  Chain, sealed O-ring type, DID 520VF or RK 520KRO, 116 links  Telescopic, coil spring, oil damped  Single shock, coil spring, oil damped  Nissin, 2-piston caliper, single disc, ABS-equipped  Nissin, 1-piston caliper, single disc, ABS-equipped  110/80-17M/C (57H), tubeless  140/55-17M/C (66H), tubeless  56.3 in. (1430 mm)  31.1 in. (790 mm)  4.0 US gal. (15 L)  Curb Weight: 399.0 lb. (181 kg)  Metallic Crystal Blue / Pearl Nebular Black"
1 miles,"$4,499 ",Burgman 200,New 2022 Suzuki Scooter,"2022 Suzuki Burgman 200, Price does not include freight charge of $590 and additional markup of $899, government fees, taxes, finance charges, dealer document processing charge, electronic filing or emission testing charges.  2022 Suzuki Burgman 200"
,"$3,399 ",DR-Z125L,New 2022 Suzuki Dirt Bike,"Here comes the 2022 DR-Z125L to make sure young and smaller stature riders can tackle the dirt. Larger 19-inch front and 16-inch rear tires, as well as a front disc brake, deliver big bike performance to a size-appropriate motorcycle. Here's the perfect platform to build essential riding skills upon, as the DR-Z125L has a true manual clutch and a five-speed transmission so riders can develop these skills as they advance within the sport of motorcycling. Styled to mirror Suzuki's Championship-winning RM-Z and RMX models, this DR-Z arrives with a race-oriented look, while the sharp handling and strong low-end and mid-range power provide the get-up-and-go that defines off-road bikes. The bike's race ready looks prove you can't judge a book by its cover, because the DR-Z125L is an unassuming, easy to ride package packed with loads of fun."
1 miles,"$16,149 ",GSX-R1000R,New 2022 Suzuki Sportbike,"2022 Suzuki GSX-R1000R, Price does not include freight charge of $590 and additional markup of $1299, government fees, taxes, finance charges, dealer document processing charge, electronic filing or emission testing charges.  2022 Suzuki GSX-R1000R"
1 miles,"$8,549 ",GSX-S750,New 2022 Suzuki Sportbike,"The new GSX-S750 brings significant engine and chassis advancements to firmly establish itself as the second model in Suzuki’s innovative lineup of performance street machines. The GSX-S750 features fresh, aggressive styling that encompasses the appearance of quality."
,"$6,849 ",DR650S,New 2022 Suzuki Cruiser,
,"$6,915 ",DR-Z400SM,New 2022 Suzuki Competition,SUPERMOTO FOR EVERYONE!!!
,"$6,499 ",RM-Z450,  2021 Suzuki Mx,
40 miles,"$7,280 ",RM-Z450,  2020 Suzuki Mx,Showroom New Condition
,"$5,000 ",RM Z 450,  2019 Suzuki Dirt Bike,Never raced. Maintained and kept in heated garage. Less than 30 hours. Starts right up and runs like a beauty. Serious inquiries only. Title not in hand (bank holds it). Will provide Bill of Sale and sign the title over once produced.
"3,271 miles","$5,500 ",650,  2018 Suzuki Dual Sport,2018 DR 650 with 3200 miles. It's a very clean motorcycle with an aftermarket exhaust and Warp 9 wheels.Bike looks and rides great. I have a set of dirt tires and wheels and another new air filter.Call 267-746-0244 serious inquiries only
"2,700 miles","$6,500 ",GSX-S 750 ABS,  2018 Suzuki Sport Touring,"Second owner, always garage kept, rear fender delete kit, small scuff on crankcase"
"18,800 miles","$3,650 ",SV650,  2003 Suzuki Sportbike,Price to sell. Excellent condition with no scratches or drops. It comes with three detachable storage cases. high performance mufler and K & N filter
"1,200 miles","$4,395 ",DR-Z 400E,  2002 Suzuki Dirt Bike,"Street Legal Dirt Bike!!Highly sought after model with a great track record! Great condition motorcycle that is street legal also. Recent tune up, oil and coolant change, new battery. Several add ons and extras, including a Yoshimura pipe and rear passenger foot pegs. Originally a California bike, now registered in Arizona. This is a gem and priced to sell at $4395 with low miles & Electric Start"
"25,000 miles","$5,495 ",GSX 1100F,  1990 Suzuki Sportbike,"Moving - potentially out of the country - and need to part with one of my favorite possessions.Brand New Tires, Fresh Oil Change, New Sprockets Front and Back, New Chain and New Brakes.Runs great. Well cared for.Starter button is a little finicky but starts every time.Serious Inquiries Only Please"
,"$7,349 ",DR-Z400SM,New 2023 Suzuki Dual Sport,"2023 Suzuki DR-Z400SM, Call (386) 740-2453. Se Habla Español. Visit DeLand Motorsports today and see how we treat customers like family. Our convenient location at 1420 N VOLUSIA AVE, ORANGE CITY, FL, is easy to reach for powersports enthusiasts from Orlando, Deltona, Daytona Beach and across Central Florida. Our brands include Suzuki, KTM, Yamaha Waverunners, Bobcat Equipment and Kymco. We are open Monday 9-5, Tues-Fri 9-6, Sat 9-5. We hope to see you soon!DISCOUNTED PRICE AND/OR INCENTIVES ARE FOR IN STOCK VEHICLES ONLY! DEALER INVENTORY ROTATES DAILY. PLEASE SEE DEALER FOR DETAILS. ANY SPECIAL ORDER OR NON IN STOCK UNITS MAY HAVE AN ADDITIONAL COST OR LOSS OF INCENTIVES. PRICE INCLUDES ALL FACTORY INCENTIVES AND REBATES. PRICE CAN NOT BE COMBINED WITH FACTORY PROMO APR % RATES. SEE OR CALL DEALER FOR DETAILS. Inventory changes daily, Most inventory needs a deposit.  2023 Suzuki DR-Z400SM"
3 miles,"$6,999 ",DR650S,New 2023 Suzuki Dual Sport,"2023 Suzuki DR650S, 2023 Suzuki DR650S"
,"$7,399 ",SV650,New 2023 Suzuki Sportbike,"Suzuki riders struck motorcycling gold when the first SV650 debuted in 1999. Since then, this iconic motorcycle has seen continual improvements while still embodying the sporty personality that only a lively, mid-sized V-twin roadster can deliver. The 2023 SV650 has a refined powerplant that provides surprising performance with low emissions and outstanding fuel economy, mounted in a trim and lightweight chassis that delivers a sporty, exciting ride."
,"$6,791 ",DR-Z400SM,New 2023 Suzuki Dual Sport,"Suzuki's 2023 SuperMoto DR-Z400SM is based on the proven DR-Z400S. So it combines Supermotard style and features in a narrow, lightweight, street-legal package. This bike brings off-road soul and fun to paved roads. It’s not uncommon to take the SuperMoto down a twisty forest road, around tight canyon corners, or through commuter traffic."
1 miles,"$7,799 ",DR-Z400SM,New 2023 Suzuki Dual Sport,"Suzuki's 2023 SuperMoto DR-Z400SM is based on the proven DR-Z400S. So it combines Supermotard style and features in a narrow, lightweight, street-legal package. This bike brings off-road soul and fun to paved roads. It’s not uncommon to take the SuperMoto down a twisty forest road, around tight canyon corners, or through commuter traffic."
3 miles,"$11,799 ",GSX-R600,New 2023 Suzuki Sportbike,"Suzuki revolutionized the sportbike category with the introduction of the original GSX-R750 in 1985, and later expanded GSX-R lineage with the addition of the GSX-R600. The 2023 GSX-R600 embodies Suzuki’s tradition of blending race-winning capability with impeccable street manners."
8 miles,"$7,749 ",DR-Z400SM,New 2023 Suzuki Dual Sport,"Suzuki's 2023 SuperMoto DR-Z400SM is based on the proven DR-Z400S. So it combines Supermotard style and features in a narrow, lightweight, street-legal package. This bike brings off-road soul and fun to paved roads. It’s not uncommon to take the SuperMoto down a twisty forest road, around tight canyon corners, or through commuter traffic."
1 miles,"$12,849 ",GSX-R750,New 2023 Suzuki Cruiser,"2023 Suzuki GSX-R750, 2023 Suzuki GSX-R750"
,"$7,799 ",DR-Z400SM,New 2023 Suzuki Dual Sport,"Suzuki's 2023 SuperMoto DR-Z400SM is based on the proven DR-Z400S. So it combines Supermotard style and features in a narrow, lightweight, street-legal package. This bike brings off-road soul and fun to paved roads. It’s not uncommon to take the SuperMoto down a twisty forest road, around tight canyon corners, or through commuter traffic."
1 miles,"$12,849 ",GSX-R750,New 2023 Suzuki Sportbike,"Suzuki revolutionized the sportbike category with the introduction of the original GSX-R750 in 1985. Today, the 2023 GSX-R750 continues Suzuki’s tradition of building Supersport bikes powered by a strong engine carried in a lightweight and nimble chassis."
,"$7,799 ",DR-Z400SM,New 2023 Suzuki Dual Sport,"2023 Suzuki DR-Z400SM, 2023 Suzuki DR-Z400SM"
3 miles,"$6,999 ",DR650S,New 2023 Suzuki Dual Sport,"2023 Suzuki DR650S, 2023 Suzuki DR650S"
1 miles,"$16,149 ",GSX-R1000,New 2023 Suzuki Cruiser,"2023 Suzuki GSX-R1000, 2023 Suzuki GSX-R1000"
,"$6,999 ",DR650S,New 2023 Suzuki Dual Sport,"2023 Suzuki DR650S, 2023 Suzuki DR650S"
,"$12,849 ",GSX-R750,New 2023 Suzuki Sportbike,"Suzuki revolutionized the sportbike category with the introduction of the original GSX-R750 in 1985. Today, the 2023 GSX-R750 continues Suzuki’s tradition of building Supersport bikes powered by a strong engine carried in a lightweight and nimble chassis."
,"$7,099 ",DR-Z400S,New 2023 Suzuki Dual Sport,"2023 Suzuki DR-Z400S, 2023 Suzuki DR-Z400S"
,"$12,899 ",GSX-R750,New 2023 Suzuki Sportbike,"2023 Suzuki GSX-R750, 2023 Suzuki GSX-R750"
,"$16,149 ",GSX-R1000,New 2023 Suzuki Sportbike,"Suzuki revolutionized the sportbike category with the introduction of the original GSX-R750 in 1985, and then created another milestone in 2001 with the introduction of the GSX-R1000. Using the lithe chassis of the GSX-R750 and a 988cc inline four-cylinder engine design that Suzuki is renowned for, liter-class Superbike performance became available to riders everywhere."
1 miles,"$11,299 ",GSX S1000,New 2022 Suzuki Standard,
"1,600 miles","$16,000 ",GSX-R 1000R,  2022 Suzuki Sportbike,"2022 GSX-R 1000R. Excellent condition, garage kept, completely stock. $16000."
"1,604 miles","$5,697 ",DR-Z400SM,  2022 Suzuki Dual Sport,"Suzuki's 2022 SuperMoto DR-Z400SM is based on the proven DR-Z400S. So it combines Supermotard style and features in a narrow, lightweight, street-legal package. This bike brings off-road soul and fun to paved roads. It's not uncommon to take the SuperMoto down a twisty forest road, around tight canyon corners, or through commuter traffic."
,"$4,999 ",Burgman 200,New 2022 Suzuki Scooter,"Everything you thought you knew about smart commuting and exciting riding is about to change. Taking advantage of Suzuki's advanced technology, the compact Burgman 200 has everything you need and more. The liquid-cooled, fuel-injected, SOHC engine is tuned for optimal performance at the low- and mid-range revs   most for commuting and exploring around town. The fully automatic transmission seamlessly puts down power by a simple twist of the wrist. Smooth is what you feel. Quiet is what you hear. And power and fuel efficiency are your rewards. Plush double-stitched seating and specially designed cutaway floorboards provide comfort second to none. The Burgman also features a huge storage compartment large enough for two full-face helmets. From its sleek Metallic Matte Stellar Blue bodywork and aerodynamic windscreen to its smooth and reliable, 200cc engine, the 2022 Burgman 200 is the smart choice for scooters."
,"$7,799 ",GSX-S750,New 2022 Suzuki Sportbike,"The GSX-S750 blends GSX-R750-derived engine performance with an ergonomically sound chassis to fashion a naked sportbike that gathers attention everywhere you ride it, thanks to its aggressive appearance. The 2022 GSX-S750’s Metallic Matte Black bodywork is complemented by a blacked-out engine, wheels, and select chassis components. Aggressive styling, strong performance, and comfortable riding posture set the GSX-S750 apart from other middleweight sportbikes, and many of those competitors cost considerably more to purchase and own."
1 miles,"$6,699 ",DR-Z400S,New 2022 Suzuki Dual Sport,"Suzuki's 2022 SuperMoto DR-Z400SM is based on the proven DR-Z400S. So it combines Supermotard style and features in a narrow, lightweight, street-legal package. This bike brings off-road soul and fun to paved roads. It's not uncommon to take the SuperMoto down a twisty forest road, around tight canyon corners, or through commuter traffic."
,"$3,399 ",RM85,New 2022 Suzuki Dirt Bike,"The 2022 RM85 continues to carry on the powerful tradition of racing excellence in the Suzuki motocross family. The reliable two-stroke engine produces smooth power at any rpm with an emphasis on low- to mid-range performance. Just like its larger RM-Z cousins, the RM85 delivers class-leading handling for both experienced racers and rookie riders alike. With its smooth power delivery and lightweight handling, the RM85 is the perfect motocross bike for anyone learning to race and striving to win!"
,"$4,499 ",RM85,New 2022 Suzuki Dirt Bike,"The 2022 RM85 continues to carry on the powerful tradition of racing excellence in the Suzuki motocross family. The reliable two-stroke engine produces smooth power at any rpm with an emphasis on low- to mid-range performance. Just like its larger RM-Z cousins, the RM85 delivers class-leading handling for both experienced racers and rookie riders alike. With its smooth power delivery and lightweight handling, the RM85 is the perfect motocross bike for anyone learning to race and striving to win!"
"32,154 miles","$7,995 ",GSX-R600,  2013 Suzuki Sportbike,"The Suzuki GSX-R600 continues its dominance in the AMA Pro Road Racing series, taking all 600cc championships in 2012 - including the Daytona Sportbike, Supersport West, and Supersport East.This further solidifies the GSX-R600 as part of a race-winning line of motorcycles from coast to coast."
"3,556 miles","$5,999 ",V-Strom 650 ABS Adventure,  2012 Suzuki Dual Sport,"2012 Suzuki V-Strom 650 ABS Adventure, This versatile bike covers daily commuting and touring and is the best-selling model in its class. The Adventure version features striking accessories such as side cases, accessory engine bar, and adjustable windscreen."
,"$8,500 ",GSX-R 1000,  2011 Suzuki Sportbike,"2011 GSXR-1000 for sale, has been sitting in my side yard for too long and it needs to go to a good home at this point. The bike is like new, has always lived under a roof, and has been taken good care of while not ridden."
"13,860 miles","$6,999 ",GSX-R 600,  2009 Suzuki Sportbike,"2009 Suzuki GSX-R 600,"
,"$5,995 ",GSX R 600,  2008 Suzuki Sportbike,"Bike was repainted by previous owner. The bike has a few blemishes, but is in great condition and runs perfect. Has just under 11,000 miles."
,"$3,499 ",GSX-R 750,  2007 Suzuki Sportbike,"2007 Suzuki GSX-R 750,   SUZUKI GSXR 750 FOR SALE! WE HAVE 600 VEHICLES IN STOCK AND ARE READY TO HIT THE OPEN ROAD! EASY FINANCING AVAILABLE!    SUZUKI GSXR 750 FOR SALE! ""MECHANIC SPECIAL"" AS IS, NO WARRANTY! SPEED DOES NOT WORK, ODOMETER DOES NOT WORK, RUNS ROUGH! CLEAN, GREEN TITLE, STARTS, RUNS, AND SHIFTS. JARDINE EXHAUST. BLUE BOOK IS $5,700! THIS ONE IS A STEAL!"
"23,000 miles","$7,499 ",BOULEVARD C90T,  2006 Suzuki Cruiser,"Great motorcycle, just serviced and new rear tire(April 5), Hoppe Quadzilla fairing, roadhouse exhaust, mustang seats"
"5,893 miles","$4,500 ",BOULEVARD C50,  2005 Suzuki Cruiser,"Well cared for Single Owner, Ultra low miles (5893), Customized 2005 Suzuki C50Have video to share - Always stored in Garage!!Custom Color, Seat, Pipes, Blinkers (both Front/Back), Wide Handle bar with soft gel grip, Wind visor & Tires are about 3 yrs old with lot of tread left.I also have original Seats as well."
"14,440 miles","$4,499 ",V Strom 1000,  2003 Suzuki Dual Sport,"2003 Suzuki V Strom 1000,"
"7,263 miles","$7,000 ",HAYABUSA 1300,  2003 Suzuki Sportbike,"2003 very beautiful bike,, has only 7,263 original miles, its been in storage,was in army and had another bike, so that one sit for a while, runs and look great, many custom parts,,"
"2,285 miles","$8,950 ",GSX-S 1000 ABS,  2020 Suzuki Sportbike,"Excellent motorcycle. Extremely low miles. Always garaged. Mint condition. Added a windscreen. Mirrors. Have original mirrors. Handle bar protectors, frame protectors. Very fun bike."
"5,800 miles","$7,900 ",GSX S 1000 ABS,  2019 Suzuki Sportbike,One ownerClean tile
"4,595 miles","$7,250 ",GSX-S 750,  2018 Suzuki Sportbike,Beautiful Bike.Always garagedNever dropped or in accidentAdult Rider/Owner Yoshimura Exhaust (Alpha)lots of extra 2 large helmetsRides perfect and in excellent condition2 alarmsbike coversecond seat for additional rider and factory cover for single riderTwo original keys and custom red key(925)-286-0496
660 miles,"$5,500 ",SV650 X,  2017 Suzuki Sportbike,2017 SUZUKI SV 650 LIKE BRAND NEW ONLY 657 MILES. NEW BATTERY. PINK SLIP IN HAND. THIS BIKE IS NON ABS
"14,000 miles","$8,495 ",GSXR 750,  2013 Suzuki Sportbike,"2013 Suzuki GSXR 750 , 2013 Suzuki GSXR 750, All new fairings, new windscreen, matching bue grips, M4 type exhaust. 14k miles. $8495.00"
"16,881 miles","$7,000 ",BOULEVARD M109R LIMITED EDITION,  2011 Suzuki Cruiser,Price reduced! Bike is in showroom condition. Recently replaced battery and oil change.
"12,780 miles","$8,200 ",BOULEVARD M109R,  2008 Suzuki Cruiser,"Selling my 2008 Suzuki M109R, which is in excellent condition, both cosmetically and mechanically. Gargage kept, never dropped, paint and chrome is beautiful. The bike has Dual Cold-Air Intakes, Cobra Speedster Sweep exhaust, Fuel Processor, Kuryakyn style dually Iso pegs, Kuryakyn style ISO chrome grips, VStream Sport Windscreen. Rear Passenger Seat and Backrest included. This bike gets a lot of compliments everytime I ride. It has a lot of power! No low ball offers."
"1,298 miles","$11,699 ",GSX R 750,  2022 Suzuki Sportbike,"Bike is clean, brand new like. The bike has about 1331 miles on it on the date of ad placement. Please feel free to contact me on 3142650771 or nitishsuresh1993@gmail.com for more information"
"1,660 miles","$7,750 ",SV 650X,  2020 Suzuki Standard,  motorcycle for sale. Owned only by one person. Minimal wear. It has always been stored inside a garage.
500 miles,"$5,995 ",DR 650,  2018 Suzuki Dual Sport,
"17,000 miles","$8,000 ",GSX-R 750,  2011 Suzuki Sportbike,"2012 Gsxr 750 m4 exhaust cat delete Chris Moore ecu flash new chain and sprocket -1+1 520 Conversion, speedo healer brembo lever and Steel braided break lines. fork seals at 15k and New front brake pads and 2 oil changes and set of new tires come with it Also all stock parts go with the bike exhaust and sprocket If you don't have a license and cash in hand you're not test riding it don't waste my time. No trades. obo"
"5,814 miles","$4,995 ",DR Z 400S,  2005 Suzuki Dirt Bike,"2005 DR-Z 400S. Yoshimura Racing Exhaust, new front tire and wheel, just had fluids changed. Like new and runs great."
,"$12,949 ",GSX-R750,New 2023 Suzuki Sportbike,
"12,194 miles","$4,500 ",BOULEVARD C90,  2008 Suzuki Cruiser,
,"$5,500 ",HAYABUSA 1300,  2003 Suzuki Sportbike,First generation Hayabusa looks like it's doing a 100mph sitting still. No major modifications and a clear title. asking $5500
"2,900 miles","$19,000 ",HAYABUSA 1340,  2022 Suzuki Sportbike,"Only 2,900 miles in excellent shape.Brand new Custom Corbin seats (with optional back rest on rear seat,) Brocks full exhaust kit, Moore Mafia flashed ECU, and Moto Composites matte carbon fiber custom made trim. This dream bike is in like new condition."
,"$13,299 ",HAYABUSA 1300R,  2020 Suzuki Sportbike,
,"$5,999 ",RMX450,  2019 Suzuki Dirt Bike,Super sweet 2019 Rmz 450 for sale. Bought it two years ago. Rode it five times at a kids track. Well-maintained. Excellent condition.
"8,115 miles","$7,700 ",GSX-S 1000 ABS,  2016 Suzuki Sportbike,"WAY below average mileage, garage kept. Aftermarket slip-on, seat cowl, mirrors, windscreen Includes two helmets and jacket, rear lift, vanity plate ""for entertainment purposes only"""
"12,444 miles","$3,000 ",BOULEVARD C50,  2007 Suzuki Cruiser,2007 Suzuki Boulevard C50 with a 800cc V-TWIN. Bike is in excellent condition with 12444 miles and has never been laid down. I and the 2nd owner and put 2444 miles on the bike since 2016. Runs great! Burgundy and Black colors. Good tires!
,"$6,999 ",DR-Z400S,New 2023 Suzuki Dual Sport,
,"$6,999 ",DR650S,New 2023 Suzuki Dual Sport,
,"$12,849 ",GSX-R750,New 2023 Suzuki Sportbike,"2023 Suzuki GSX-R750,"
,"$6,999 ",DR650S,New 2023 Suzuki Dual Sport,"2023 Suzuki DR650S,"
,No Price Listed,GSX-S 750,New 2022 Suzuki Sportbike,"The GSX-S750 blends GSX-R750-derived engine performance with an ergonomically sound chassis to fashion a naked sportbike that gathers attention everywhere you ride it, thanks to its aggressive appearance. The 2022 GSX-S750’s Metallic Matte Black bodywork is complemented by a blacked-out engine, wheels, and select chassis components. Aggressive styling, strong performance, and comfortable riding posture set the GSX-S750 apart from other middleweight sportbikes, and many of those competitors cost considerably more to purchase and own.The 2022 GSX-S750 inherits its heart and soul from Suzuki’s MotoGP race experience and the 35-year heritage of the GSX-R750. With strong, torque-rich engine power managed by rider-adjustable traction control, the GSX-S750 is ready to capture hearts and turn heads as the performance leader in its class. This is the perfect sportbike response to the craving of today’s discriminating riders, as the GSX-S750 looks great and outperforms other entries in the class. It is nimble, comfortable, and an exhilarating, fun ride that retains Suzuki’s heritage of quality, reliability, and value."
,No Price Listed,SV650,New 2023 Suzuki Sportbike,"Suzuki riders struck motorcycling gold when the first SV650 debuted in 1999. Since then, this iconic motorcycle has seen continual improvements while still embodying the sporty personality that only a lively, mid-sized V-twin roadster can deliver. The 2023 SV650 has a refined powerplant that provides surprising performance with low emissions and outstanding fuel economy, mounted in a trim and lightweight chassis that delivers a sporty, exciting ride.The SV650’s nimble chassis achieves exciting lean angles when cornering, while a pair of four-piston Tokico brake calipers up front deliver excellent stopping power. The 2023 SV650's Glass Sparkle Black and Solid Iron Gray bodywork is draped upon a gray trellis frame that rolls upon red, cast-aluminum wheels. This stunning look and style, combined with sparkling performance, delivers sportbike value that a broad range of riders will embrace."
